<?xml version="1.0" encoding="UTF-8" standalone="no"?>
<!DOCTYPE OPS_envelope SYSTEM 'ops.dtd'>
<OPS_envelope>
  <header><version>0.9</version></header>
  <body>
    <data_block>
      <dt_assoc>
        <item key="protocol">XCP</item>
        <item key="object">DOMAIN</item>
        <item key="action">REPLY</item>
        <item key="is_success">1</item>
        <item key="attributes">
          <dt_assoc>
            <item key="page">1</item>
            <item key="page_size">40</item>
            <item key="total">3</item>
            <item key="del_domains">
              <dt_array>
                <item key="0">
                  <dt_assoc>
                    <item key="name">example1.com</item>
                    <item key="delete_date">01-MAR-2021 12:08:11</item>
                    <item key="delete_date_epoch">1614618491</item>
                    <item key="expiredate">01-MAR-2022 17:07:17</item>
                    <item key="expiredate_epoch">1646172437</item>
                    <item key="reason">By-Request</item>
                  </dt_assoc>
                </item>
              </dt_array>
            </item>
          </dt_assoc>
        </item>
        <item key="response_code">200</item>
        <item key="response_text">Command successful</item>
      </dt_assoc>
    </data_block>
  </body>
</OPS_envelope>
